{
  "institution_id": "cist-college",
  "nirf_name": "CIST College",
  "government_listing_sources": [
    "https://www.nirfindia.org/Rankings/2025/CollegeRankingALL.html",
    "https://www.nirfindia.org/Rankings/2025/OverallRankingALL.html"
  ],
  "verification_outcome": "remove_candidate",
  "district": null,
  "district_verification_status": "not_found",
  "official_website": null,
  "website_verification_status": "not_found",
  "description": null,
  "description_verification_status": "not_found",
  "record_status": "remove_candidate",
  "allowed_official_domains": [],
  "verification_sources": [
    {
      "type": "government_listing",
      "url": "https://www.nirfindia.org/Rankings/2025/CollegeRankingALL.html",
      "supports": [
        "Exact CIST College entry with VIDISHA and Madhya Pradesh"
      ]
    },
    {
      "type": "government_listing",
      "url": "https://www.nirfindia.org/Rankings/2025/OverallRankingALL.html",
      "supports": [
        "Exact CIST College entry with VIDISHA and Madhya Pradesh"
      ]
    }
  ],
  "website_search_evidence": [
    {
      "query": "\"CIST College\" Vidisha official website",
      "result": "Search returned an official-looking candidate at cist.kbtgroup.in and non-authoritative directory results. Direct HTTPS access to the candidate failed with DNS resolution error.",
      "url": "https://cist.kbtgroup.in/"
    },
    {
      "query": "\"CIST College\" Vidisha admissions",
      "result": "Search returned non-authoritative admission listings and cist.kbtgroup.in/about-us; no accessible official institution page was established.",
      "url": "https://cist.kbtgroup.in/about-us/"
    },
    {
      "query": "\"CIST College\" Vidisha courses",
      "result": "Search returned non-authoritative course listings, an MP Higher Education profile, and cist.kbtgroup.in; no accessible official course catalogue was established.",
      "url": "https://cist.kbtgroup.in/"
    },
    {
      "query": "\"CIST College\" \"Mohan Giri\"",
      "result": "Search returned only local-directory results for Mohan Giri, Vidisha; no official institution website result.",
      "url": null
    },
    {
      "query": "CIST College Vidisha Madhya Pradesh",
      "result": "Search returned directories and a Vidisha government colleges page, but no accessible official institution website.",
      "url": "https://vidisha.nic.in/en/public-utility-category/colleges/"
    },
    {
      "query": "site:ac.in \"CIST College\"",
      "result": "No relevant official institution website result; unrelated or non-authoritative results only.",
      "url": null
    },
    {
      "query": "Bing: \"CIST College\" Vidisha official website",
      "result": "Search returned unrelated results and no relevant official institution website.",
      "url": null
    },
    {
      "query": "Google: \"CIST College\" Vidisha official",
      "result": "Search request returned HTTP 429; no usable result.",
      "url": null
    },
    {
      "query": "Official-domain check: https://cist.kbtgroup.in/",
      "result": "HTTPS and HTTP requests failed because the hostname could not be resolved; the official page could not be read.",
      "url": "https://cist.kbtgroup.in/"
    },
    {
      "query": "Authoritative-domain check: Madhya Pradesh Higher Education institute profile for CIST College",
      "result": "Search surfaced the government profile URL, but direct access encountered the managed proxy certificate-chain error and the permitted insecure retry timed out without content; it was not used for website or catalogue verification.",
      "url": "https://www.mphighereducation.nic.in/InstitutePortal/Public/Institute_Profile.aspx?InstId=NDE%3D"
    }
  ],
  "course_catalogue_status": "not_found",
  "courses": [],
  "agent_notes": [
    "The institution is listed exactly in both supplied NIRF 2025 government-directory pages.",
    "Focused searches surfaced a stale or inaccessible candidate domain, cist.kbtgroup.in, but no current official institution website or official programme catalogue could be read.",
    "Normal TLS encountered the managed proxy self-signed certificate-chain error; curl --insecure was used only for public GET requests to confirmed government/search domains.",
    "Aggregator and directory results were treated as discovery evidence only and not used for verification."
  ]
}
