{
  "institution_id": "sardar-patel-university",
  "nirf_name": "Sardar Patel University",
  "government_listing_sources": [
    "https://www.nirfindia.org/Rankings/2025/AgricultureRankingALL.html",
    "https://www.nirfindia.org/Rankings/2025/EngineeringRankingALL.html",
    "https://www.nirfindia.org/Rankings/2025/LawRankingALL.html",
    "https://www.nirfindia.org/Rankings/2025/ManagementRankingALL.html",
    "https://www.nirfindia.org/Rankings/2025/OverallRankingALL.html",
    "https://www.nirfindia.org/Rankings/2025/PharmacyRankingALL.html"
  ],
  "verification_outcome": "manual_review",
  "district": "Balaghat",
  "district_verification_status": "verified_official_website",
  "official_website": "https://spubgt.ac.in/",
  "website_verification_status": "verified",
  "description": "Sardar Patel University is a state private university established under Madhya Pradesh Act No. 26 of 2011. Its unitary campus is at Sardar Patel Knowledge City, Waraseoni Road, Dongariya, Balaghat, Madhya Pradesh.",
  "description_verification_status": "verified_official_website",
  "record_status": "manual_review",
  "allowed_official_domains": [],
  "verification_sources": [
    {
      "type": "government_listing",
      "url": "https://www.nirfindia.org/Rankings/2025/AgricultureRankingALL.html",
      "supports": [
        "Exact Sardar Patel University row with Balaghat, Madhya Pradesh"
      ]
    },
    {
      "type": "government_listing",
      "url": "https://www.nirfindia.org/Rankings/2025/EngineeringRankingALL.html",
      "supports": [
        "Exact Sardar Patel University row with Balaghat, Madhya Pradesh"
      ]
    },
    {
      "type": "government_listing",
      "url": "https://www.nirfindia.org/Rankings/2025/LawRankingALL.html",
      "supports": [
        "Exact Sardar Patel University row with Balaghat, Madhya Pradesh"
      ]
    },
    {
      "type": "government_listing",
      "url": "https://www.nirfindia.org/Rankings/2025/ManagementRankingALL.html",
      "supports": [
        "Exact Balaghat row; separate same-name Gujarat row excluded"
      ]
    },
    {
      "type": "government_listing",
      "url": "https://www.nirfindia.org/Rankings/2025/OverallRankingALL.html",
      "supports": [
        "Exact Balaghat row; separate same-name Gujarat row excluded"
      ]
    },
    {
      "type": "government_listing",
      "url": "https://www.nirfindia.org/Rankings/2025/PharmacyRankingALL.html",
      "supports": [
        "Exact Sardar Patel University row with Balaghat, Madhya Pradesh"
      ]
    },
    {
      "type": "official_homepage",
      "url": "https://spubgt.ac.in/",
      "supports": [
        "Official identity, Balaghat address, enquiry programme list, and current Ph.D. notification banner"
      ]
    },
    {
      "type": "official_district_campus",
      "url": "https://spubgt.ac.in/about-university/",
      "supports": [
        "State private university identity and Balaghat campus address"
      ]
    },
    {
      "type": "official_catalogue",
      "url": "https://spubgt.ac.in/school-of-engineering-technology/",
      "supports": [
        "Engineering regular and part-time course tables"
      ]
    },
    {
      "type": "official_catalogue",
      "url": "https://spubgt.ac.in/school-of-agriculture-science-technology-research/",
      "supports": [
        "Agriculture course table"
      ]
    },
    {
      "type": "official_catalogue",
      "url": "https://spubgt.ac.in/school-of-pharmaceutical-science-research/",
      "supports": [
        "Pharmacy course table"
      ]
    },
    {
      "type": "official_catalogue",
      "url": "https://spubgt.ac.in/institute-of-pharmaceutical-science-research/",
      "supports": [
        "Pharmacy course table including M.Pharmacy programmes"
      ]
    },
    {
      "type": "official_catalogue",
      "url": "https://spubgt.ac.in/sardar-patel-ayurvedic-medical-college-hospital/",
      "supports": [
        "Ayurveda constituent-college identity; no structured course table"
      ]
    },
    {
      "type": "official_catalogue",
      "url": "https://spubgt.ac.in/sardar-patel-college-of-nursing/",
      "supports": [
        "Nursing course table"
      ]
    },
    {
      "type": "official_catalogue",
      "url": "https://spubgt.ac.in/school-of-paramedical-education/",
      "supports": [
        "Paramedical course table"
      ]
    },
    {
      "type": "official_catalogue",
      "url": "https://spubgt.ac.in/school-of-education/",
      "supports": [
        "Education course table"
      ]
    },
    {
      "type": "official_catalogue",
      "url": "https://spubgt.ac.in/school-of-commerce-and-management/",
      "supports": [
        "Commerce and management course table"
      ]
    },
    {
      "type": "official_catalogue",
      "url": "https://spubgt.ac.in/school-of-science-computer-application/",
      "supports": [
        "Science and computer application course table"
      ]
    },
    {
      "type": "official_catalogue",
      "url": "https://spubgt.ac.in/school-of-legal-studies-research/",
      "supports": [
        "Law course table"
      ]
    },
    {
      "type": "official_catalogue",
      "url": "https://spubgt.ac.in/school-of-arts-social-science/",
      "supports": [
        "Arts and social science course table"
      ]
    },
    {
      "type": "official_catalogue",
      "url": "https://spubgt.ac.in/ph-d-notification/",
      "supports": [
        "Ph.D. notification page"
      ]
    }
  ],
  "website_search_evidence": [
    {
      "query": "Sardar Patel University Balaghat official website",
      "result": "Used for discovery only; official pages were verified directly.",
      "url": null
    },
    {
      "query": "site:*.edu.in \"Sardar Patel University\" Balaghat",
      "result": "Discovery results identified spubgt.ac.in among similarly named domains; the domain was checked directly.",
      "url": "https://spubgt.ac.in/"
    },
    {
      "query": "\"Sardar Patel University\" \"Balaghat\" admissions",
      "result": "Used for discovery only; the official admissions page was checked directly.",
      "url": "https://spubgt.ac.in/admission-notification/"
    }
  ],
  "course_catalogue_status": "partial_official_website",
  "courses": [],
  "agent_notes": [
    "NIRF listings establish the assigned institution in Balaghat, Madhya Pradesh; same-name Vallabh Vidyanagar, Gujarat rows were excluded.",
    "The official site identifies a unitary campus at Sardar Patel Knowledge City, Waraseoni Road, Dongariya, Balaghat.",
    "The managed proxy returned the exact self-signed certificate-chain error; permitted --insecure fallback was used only for public GETs on expected domains.",
    "Detailed course tables are available for engineering, agriculture, pharmacy, nursing, paramedical education, education, commerce and management, science/computer applications, law, and arts/social science. The Ayurveda page has no structured course table, while the enquiry form lists additional options such as BAMS, MD Ayurveda, Post Basic B.Sc Nursing, M.Sc Nursing, and ANM Nursing without detailed programme pages. The Ph.D. notification confirms doctoral admissions but lacks discipline-specific catalogue details. Manual review is required."
  ]
}
