{
  "institution_id": "alpha-college-shyampur",
  "nirf_name": "ALPHA COLLEGE, SHYAMPUR",
  "government_listing_sources": [
    "https://www.nirfindia.org/Rankings/2025/CollegeRankingALL.html",
    "https://www.nirfindia.org/Rankings/2025/OverallRankingALL.html"
  ],
  "verification_outcome": "remove_candidate",
  "district": null,
  "district_verification_status": "not_found",
  "official_website": null,
  "website_verification_status": "not_found",
  "description": null,
  "description_verification_status": "not_found",
  "record_status": "remove_candidate",
  "allowed_official_domains": [],
  "verification_sources": [
    {
      "type": "government_listing",
      "url": "https://www.nirfindia.org/Rankings/2025/CollegeRankingALL.html",
      "supports": [
        "Exact institution name, city, and state appear in the India Rankings 2025 College participating-institute list."
      ]
    },
    {
      "type": "government_listing",
      "url": "https://www.nirfindia.org/Rankings/2025/OverallRankingALL.html",
      "supports": [
        "Exact institution name, city, and state appear in the India Rankings 2025 Overall participating-institute list."
      ]
    }
  ],
  "website_search_evidence": [
    {
      "query": "\"ALPHA COLLEGE, SHYAMPUR\" Sehore Madhya Pradesh official website",
      "result": "No official institution website was returned; unrelated results only.",
      "url": "https://www.google.com/search?gbv=1&num=10&q=%22ALPHA%20COLLEGE%2C%20SHYAMPUR%22%20Sehore%20Madhya%20Pradesh%20official%20website"
    },
    {
      "query": "\"Alpha College\" Shyampur Sehore college",
      "result": "No official institution website was returned; unrelated results only.",
      "url": "https://www.bing.com/search?q=%22Alpha%20College%22%20Shyampur%20Sehore%20college"
    },
    {
      "query": "site:ac.in \"Alpha College\" Shyampur",
      "result": "No .ac.in institutional result was returned.",
      "url": "https://www.bing.com/search?q=site%3Aac.in%20%22Alpha%20College%22%20Shyampur"
    },
    {
      "query": "site:mp.gov.in \"ALPHA COLLEGE\" \"SHYAMPUR\"",
      "result": "No official MP government institutional result was returned.",
      "url": "https://www.bing.com/search?q=site%3Amp.gov.in%20%22ALPHA%20COLLEGE%22%20%22SHYAMPUR%22"
    },
    {
      "query": "site:edu.in \"ALPHA COLLEGE\" \"SHYAMPUR\"",
      "result": "No .edu.in institutional result was returned.",
      "url": "https://www.bing.com/search?q=site%3Aedu.in%20%22ALPHA%20COLLEGE%22%20%22SHYAMPUR%22"
    },
    {
      "query": "site:nic.in \"Alpha College\" Shyampur",
      "result": "No .nic.in institutional result was returned.",
      "url": "https://www.bing.com/search?q=site%3Anic.in%20%22Alpha%20College%22%20Shyampur"
    },
    {
      "query": "site:highereducation.mp.gov.in Shyampur college Sehore",
      "result": "No official higher-education page for this institution was returned.",
      "url": "https://www.google.com/search?gbv=1&num=10&q=site%3Ahighereducation.mp.gov.in%20Shyampur%20college%20Sehore"
    },
    {
      "query": "site:educationportal.mp.gov.in Shyampur college Sehore",
      "result": "No official education-portal page for this institution was returned.",
      "url": "https://www.google.com/search?gbv=1&num=10&q=site%3Aeducationportal.mp.gov.in%20Shyampur%20college%20Sehore"
    },
    {
      "query": "site:mp.gov.in Shyampur college Sehore",
      "result": "No official MP government page for this institution was returned.",
      "url": "https://www.google.com/search?gbv=1&num=10&q=site%3Amp.gov.in%20Shyampur%20college%20Sehore"
    },
    {
      "query": "site:ac.in Shyampur college Sehore Madhya Pradesh",
      "result": "No .ac.in institutional result was returned.",
      "url": "https://www.google.com/search?gbv=1&num=10&q=site%3Aac.in%20Shyampur%20college%20Sehore%20Madhya%20Pradesh"
    },
    {
      "query": "\"ALPHA COLLEGE\" SHYAMPUR SEHORE",
      "result": "No official institution website was returned; unrelated results only.",
      "url": "https://www.google.com/search?gbv=1&num=10&q=%22ALPHA%20COLLEGE%22%20SHYAMPUR%20SEHORE"
    },
    {
      "query": "\"ALPHA COLLEGE, SHYAMPUR\"",
      "result": "No official institution website was returned; unrelated results only.",
      "url": "https://www.bing.com/search?format=rss&q=%22ALPHA%20COLLEGE%2C%20SHYAMPUR%22"
    },
    {
      "query": "\"Alpha College\" \"Shyampur\" Madhya Pradesh",
      "result": "No official institution website was returned; unrelated results only.",
      "url": "https://www.bing.com/search?format=rss&q=%22Alpha%20College%22%20%22Shyampur%22%20Madhya%20Pradesh"
    },
    {
      "query": "site:mp.gov.in \"ALPHA COLLEGE\"",
      "result": "No official MP government institutional result was returned.",
      "url": "https://www.google.com/search?gbv=1&num=10&q=site%3Amp.gov.in%20%22ALPHA%20COLLEGE%22"
    },
    {
      "query": "https://highereducation.mp.gov.in/ClgProfile",
      "result": "The official MP Higher Education page was checked for Alpha and Shyampur; no matching occurrence was found. It was used only as an authoritative-domain check, not as institution evidence.",
      "url": "https://highereducation.mp.gov.in/ClgProfile"
    }
  ],
  "course_catalogue_status": "not_found",
  "courses": [],
  "agent_notes": [
    "Government listing established in both supplied NIRF 2025 participating-institute pages; the exact listing is ALPHA COLLEGE, SHYAMPUR, city sehore, Madhya Pradesh.",
    "Normal TLS verification failed with the exact managed-proxy self-signed certificate-chain error on expected public HTTPS hosts; public GETs were retried with --insecure as permitted.",
    "After focused searches and authoritative-domain checks, no official institution website or official programme catalogue could be established. Per the outcome rules, this record is remove_candidate.",
    "No district, description, or courses were imported because the required official institutional website evidence was not found."
  ]
}
